Company Name,Address,Phone Number,Google business profile link,Website,E-Mail,Linkedin-Link
Hacker School - Cyber Security Course and Ethical Hacking Training Hub,"No: 36, Vasavi Avenue, 2nd Floor, 11th Main Rd, 5th Block, Jayanagar, Bengaluru, Karnataka 560041 ",09599638639,https://www.google.com/maps/place/Hacker+School+-+Cyber+Security+Course+and+Ethical+Hacking+Training+Hub/data=!4m7!3m6!1s0x3bae159f6012a051:0xf82783d3e5014ee8!8m2!3d12.9230109!4d77.5858361!16s%2Fg%2F1q5bmpxf4!19sChIJUaASYJ8VrjsR6E4B5dODJ_g?authuser=0&hl=en&rclk=1,https://www.hackerschool.in/,['inquiry@hackerschool.in'],https://in.linkedin.com/company/hackerschoolin
"Texial Cyber Security | Ethical Hacking Course - CEH, CHFI, SOC","50, 12th Main Rd, 4th T Block East, 4th Block, Jayanagar, Bengaluru, Karnataka 560011 ",09886655699,"https://www.google.com/maps/place/Texial+Cyber+Security+%7C+Ethical+Hacking+Course+-+CEH,+CHFI,+SOC/data=!4m7!3m6!1s0x3bae3dfb418d7b5f:0x627d825864b5e248!8m2!3d12.9292306!4d77.5866787!16s%2Fg%2F11ffkjz10m!19sChIJX3uNQfs9rjsRSOK1ZFiCfWI?authuser=0&hl=en&rclk=1",https://texial.net/ethical-hacking-course-in-bangalore-ceh-certification/,['admission@texial.net'],https://in.linkedin.com/company/texial
Hackers University APC Learning Solutions,"Tower 1, Prestige Meridian, 107, Mahatma Gandhi Rd, Yellappa Chetty Layout, Sivanchetti Gardens, Bengaluru, Karnataka 560042 ",07483255153,https://www.google.com/maps/place/Hackers+University+APC+Learning+Solutions/data=!4m7!3m6!1s0x3bae1715a9745507:0xef18a11aea788af9!8m2!3d12.9725481!4d77.6191141!16s%2Fg%2F11yccqnc2q!19sChIJB1V0qRUXrjsR-Yp46hqhGO8?authuser=0&hl=en&rclk=1,https://www.apclearning.com/,['suzanne.miller@apclearning.com'],https://in.linkedin.com/company/apc-learning-solutions
"Indian Cyber Security Solutions (Best Ethical Hacking Training, CompTIA course and VAPT service in Bangalore)","No,55 2nd floor, 3rd Cross Rd, near Vision Express, St Thomas Town, Ramaiah Layout, Kammanahalli, Bengaluru, Karnataka 560084 ",09831318312,"https://www.google.com/maps/place/Indian+Cyber+Security+Solutions+%28Best+Ethical+Hacking+Training,+CompTIA+course+and+VAPT+service+in+Bangalore%29/data=!4m7!3m6!1s0x3bae1307705adb37:0x38cb6f50fe60f158!8m2!3d13.0159333!4d77.6362174!16s%2Fg%2F11gkvs_kqt!19sChIJN9tacAcTrjsRWPFg_lBvyzg?authuser=0&hl=en&rclk=1",https://indianinstituteofcybersecurity.com/,['info@indianinstituteofcybersecurity.com'],Not present on google business profiles
Hacking Services,"6, 7th Main Road, 80 feet Road, Kormangala, Bengaluru - 560034, Electronics City, Karnataka 560034 ",Not present on google business profiles,https://www.google.com/maps/place/Hacking+Services/data=!4m7!3m6!1s0x3bae15566438a8a3:0x667452e56f46eeb2!8m2!3d12.9275114!4d77.6328402!16s%2Fg%2F11xcrpqrhw!19sChIJo6g4ZFYVrjsRsu5Gb-VSdGY?authuser=0&hl=en&rclk=1,Not present on google business profiles,[],Not present on google business profiles
Myna Cyber Security | Ethical Hacking Corporate Training Course With AI,"9TH FLOOR, VALENCE BLOCK, PRESTIGE TECH PARK, Marathahalli - Sarjapur Outer Ring Rd, Kadubeesanahalli, Bengaluru, Karnataka 560103 ",Not present on google business profiles,https://www.google.com/maps/place/Myna+Cyber+Security+%7C+Ethical+Hacking+Corporate+Training+Course+With+AI/data=!4m7!3m6!1s0x3bae13a7d99b10d7:0xb1ad4660d6267cbd!8m2!3d12.9437226!4d77.6909436!16s%2Fg%2F11mt5pb661!19sChIJ1xCb2acTrjsRvXwm1mBGrbE?authuser=0&hl=en&rclk=1,Not present on google business profiles,"['info@mynasolutions.com', 'myna.scidoc@yahoo.com', 'mpl@mynapathlabs.com']",https://www.linkedin.com/company/mynapartners
Ethical Hacking Services Hire a Hacker,Not present on google business profiles,Not present on google business profiles,https://www.google.com/maps/place/Ethical+Hacking+Services+Hire+a+Hacker/data=!4m7!3m6!1s0x601a678f9a79709f:0xa2cd0ea854118b07!8m2!3d21.7770572!4d79.1341654!16s%2Fg%2F11sjg_b74v!19sChIJn3B5mo9nGmARB4sRVKgOzaI?authuser=0&hl=en&rclk=1,Not present on google business profiles,[],Not present on google business profiles
Ethical Hacking Course,"1st floor, 131, 6th C Main Road, 4th Block, Jayanagar, Bengaluru, Karnataka 560011 ",Not present on google business profiles,https://www.google.com/maps/place/Ethical+Hacking+Course/data=!4m7!3m6!1s0x3bae15990758295d:0xef0e665d0e64960!8m2!3d12.9298169!4d77.5816804!16s%2Fg%2F11jvdnx6n7!19sChIJXSlYB5kVrjsRYEnm0GXm8A4?authuser=0&hl=en&rclk=1,Not present on google business profiles,"['sandeep@isoeh.com', 'press@eccouncil.org', 'inquiry@hackerschool.in', 'training@craw.in']",Not present on google business profiles
